{
  "schema_version": "1.0",
  "visit_id": "01j4w4j0k7hm9j9tx3jz8s2n5q",
  "job_id": "01j4w4hy5kd6zmx4pc4k2xv7br",
  "requested_url": "https://example.org/docs",
  "normalized_requested_url": "https://example.org/docs",
  "final_url": "https://example.org/docs/",
  "page_id": "01j4w4j6v2v4p84n8v7v60m0s7",
  "version_id": "01j4w4j7mr6c9s7cezz9n5f2qp",
  "operation": "fetch",
  "mode": "auto",
  "engine": "crawlee-http",
  "state": "succeeded",
  "network_attempted": true,
  "http_status": 200,
  "redirect_chain": [],
  "receipt_artifact_id": "01j4w4j9a3jpsk9r7jcrg29q01",
  "raw_artifact_id": "01j4w4j8gv95v1x2n7e1ss6q61",
  "markdown_artifact_id": "01j4w4j8v3wx04ssprfy0dnt80",
  "visibility": "internal",
  "started_at": "2026-08-09T12:00:00Z",
  "completed_at": "2026-08-09T12:00:01Z",
  "duration_ms": 1000,
  "warnings": []
}
